{
  "advisory_rule_results": [],
  "case_id": "hsp90_directional_time_anatomy_development_v1_alpha",
  "current_claim_ceiling": "At most, the exact frozen same-packet diagnostic has a validated trajectory-level control record. No transition rate, equilibrium, population, free-energy, pathway, mechanism, or mutation claim is emitted.",
  "development_status": "EXPOSED_DEVELOPMENT_ACTIVE",
  "evidence_results": [
    {
      "evidence_kind": "OPERATOR_EVIDENCE_RESULT",
      "result": {
        "affected_rule_instance_id": "F04R02_SOURCE_DECLARED_TIME_ANATOMY_CONTROL::SOURCE::hsp90_md_round2_directional_packet",
        "case_id": "hsp90_directional_time_anatomy_development_v1_alpha",
        "claim_ceiling": "Validated execution of one frozen same-packet trajectory-level directional-time-anatomy control record; human scientific validation remains required.",
        "contract_status": "PASS",
        "evidence_result_id": "HSP90-TIME-ANATOMY-EVIDENCE::B1_EXACT_HSP90_RULE_TO_OPERATOR",
        "forbidden_claims": [
          "TRANSITION_RATE",
          "EQUILIBRIUM_POPULATION",
          "FREE_ENERGY",
          "COMPLETE_PATHWAY",
          "MECHANISM",
          "MUTATION_EFFECT"
        ],
        "method_profile_id": "hsp90_md_directional_time_anatomy_v0",
        "operator_id": "hsp90.directional_time_anatomy.v1_case_bound",
        "operator_run_receipt_id": "HSP90-TIME-ANATOMY-RECEIPT::B1_EXACT_HSP90_RULE_TO_OPERATOR",
        "operator_version": "1.0.0-exposed-case-bound-adapter",
        "output_validation": {
          "observed_counts": {
            "directional_run_rows": 1175,
            "trajectory_time_anatomy_rows": 120,
            "trajectory_time_bin_rows": 840
          },
          "output_hashes": {
            "directional_runs.tsv": "9650bc5beb3ab4dd7163b256e317459e64f524d0803ba8c985ff6bdec6047666",
            "results_summary.json": "f285a33c63a59f1601f0aefa4f98afe62fb247121c575574cf1f42018d93e646",
            "trajectory_time_anatomy.tsv": "fc841ea76a8ff061797690fb29cbffb119e3bd824a816c7c1885b6dca6ce86cb",
            "trajectory_time_bins_50ns.tsv": "1cdbe525b288f231c9f4bbecfa2ee0873ac3e2c4e7f30879db43759fc1d3cf8c"
          },
          "reason_codes": [],
          "status": "PASS"
        },
        "result": {
          "allowed_wording": "Describes persistent two-readout directional departure and return candidates under an explicit horizon grid.",
          "display_bin": "50 saved frames (about 50 ns; the last bin has 51 frames)",
          "evidence_level": "v0_same_packet_diagnostic",
          "forbidden_wording": "Does not estimate a transition rate, equilibrium, population, free energy, complete pathway, mechanism, or mutation effect.",
          "inputs": {
            "frame_state_assignments.tsv": {
              "sha256": "80334c79a2c6c0d6073f1910086eac5670aa38105ed03d83d12330e54da13e46"
            },
            "route_predictions.tsv": {
              "sha256": "409164d01ec0d36ae2c74882e4eef669697a968544bdb24bbe1035b3ddfa2446"
            }
          },
          "persistence_grid_saved_frames": [
            5,
            20,
            50
          ],
          "statistical_unit": "trajectory (n=40); frame runs are within-trajectory descriptive objects",
          "summary": {
            "20": {
              "by_seed_lineage": {
                "closed_seeded": {
                  "n_trajectories": 20,
                  "opposite_departure_candidate_n": 4,
                  "return_candidate_n": 0
                },
                "open_seeded": {
                  "n_trajectories": 20,
                  "opposite_departure_candidate_n": 0,
                  "return_candidate_n": 0
                }
              },
              "n_trajectories": 40,
              "opposite_departure_candidate_n": 4,
              "return_candidate_n": 0,
              "strict_core_frame_count_total": 3
            },
            "5": {
              "by_seed_lineage": {
                "closed_seeded": {
                  "n_trajectories": 20,
                  "opposite_departure_candidate_n": 5,
                  "return_candidate_n": 0
                },
                "open_seeded": {
                  "n_trajectories": 20,
                  "opposite_departure_candidate_n": 0,
                  "return_candidate_n": 0
                }
              },
              "n_trajectories": 40,
              "opposite_departure_candidate_n": 5,
              "return_candidate_n": 0,
              "strict_core_frame_count_total": 3
            },
            "50": {
              "by_seed_lineage": {
                "closed_seeded": {
                  "n_trajectories": 20,
                  "opposite_departure_candidate_n": 1,
                  "return_candidate_n": 0
                },
                "open_seeded": {
                  "n_trajectories": 20,
                  "opposite_departure_candidate_n": 0,
                  "return_candidate_n": 0
                }
              },
              "n_trajectories": 40,
              "opposite_departure_candidate_n": 1,
              "return_candidate_n": 0,
              "strict_core_frame_count_total": 3
            }
          },
          "task": "dynamics_atlas_hsp90_time_anatomy_v0_20260730"
        },
        "schema_version": "evidence-result/v1-alpha",
        "scientific_evaluation_status": "PENDING_HUMAN_VALIDATION",
        "source_id": "hsp90_md_round2_directional_packet",
        "status": "OBSERVED"
      }
    }
  ],
  "failed_rule_results": [],
  "first_failed_dependency": {
    "affected_rule_instance_id": "F04R02_SOURCE_DECLARED_TIME_ANATOMY_CONTROL::SOURCE::hsp90_md_round2_directional_packet",
    "dependency_kind": "EVIDENCE_RESULT",
    "evidence_kind": "OPERATOR_EVIDENCE_RESULT",
    "evidence_result_id": "HSP90-TIME-ANATOMY-EVIDENCE::B1_EXACT_HSP90_RULE_TO_OPERATOR",
    "reason_code": "EVIDENCE_RESULT_PENDING_HUMAN_VALIDATION",
    "status": "PENDING_HUMAN_VALIDATION"
  },
  "human_final_authority": true,
  "human_review_items": [
    "The EvidenceResult validates the exact execution contract, not source science or a biological mechanism.",
    "The diagnostic remains trajectory-level and same-packet; frames are correlated observations, not independent replicates.",
    "Any rate, equilibrium, population, free-energy, pathway, mechanism, or mutation wording is forbidden.",
    "Source-science review remains PENDING_DOMAIN_REVIEW for F04_SOURCE_RELIABILITY_AND_UNCERTAINTY.",
    "Operator EvidenceResult remains PENDING_HUMAN_VALIDATION; execution-contract PASS is not source-science approval."
  ],
  "next_action": "Do not emit the requested scientific claim; resolve the first dependency or obtain human source-science review.",
  "operator_receipts": [
    {
      "affected_rule_instance_id": "F04R02_SOURCE_DECLARED_TIME_ANATOMY_CONTROL::SOURCE::hsp90_md_round2_directional_packet",
      "case_id": "hsp90_directional_time_anatomy_development_v1_alpha",
      "claim_ceiling": "Validated execution of one frozen same-packet trajectory-level directional-time-anatomy control record; human scientific validation remains required.",
      "fixed_parameters": {
        "persistence_saved_frames": [
          5,
          20,
          50
        ],
        "state_rule": "existing zero-sign two-readout rule"
      },
      "input_manifest_id": "hsp90-directional-time-anatomy-inputs/v1-alpha",
      "manifest_receipt": {
        "expected_time_contract": {
          "analysis_window_ns": [
            20,
            1020
          ],
          "frame_dependence": "CORRELATED_WITHIN_TRAJECTORY",
          "frames_per_trajectory": 1001,
          "saved_stride_ns": 1,
          "statistical_unit": "TRAJECTORY",
          "trajectory_count": 40
        },
        "fixed_parameters": {
          "persistence_saved_frames": [
            5,
            20,
            50
          ],
          "state_rule": "existing zero-sign two-readout rule"
        },
        "manifest_id": "hsp90-directional-time-anatomy-inputs/v1-alpha",
        "resolved_assets": {
          "frame_state_assignments": {
            "sha256": "80334c79a2c6c0d6073f1910086eac5670aa38105ed03d83d12330e54da13e46",
            "workspace_relative_path": "evidence/real_case_vertical_slice_v1/frozen_inputs/hsp90/frame_state_assignments.tsv"
          },
          "implementation": {
            "sha256": "84e47d7abf6ab786f6b7125d1a130f28196b2cc7f301b28674c5a7277b303292",
            "workspace_relative_path": "evidence/real_case_vertical_slice_v1/frozen_inputs/hsp90/run_time_anatomy_v0_frozen.py"
          },
          "route_predictions": {
            "sha256": "409164d01ec0d36ae2c74882e4eef669697a968544bdb24bbe1035b3ddfa2446",
            "workspace_relative_path": "evidence/real_case_vertical_slice_v1/frozen_inputs/hsp90/route_predictions.tsv"
          }
        }
      },
      "operator_id": "hsp90.directional_time_anatomy.v1_case_bound",
      "operator_registry_id": "dynamics-atlas-registered-operators/v0.2",
      "operator_version": "1.0.0-exposed-case-bound-adapter",
      "output_contract": "hsp90-time-anatomy-results/v1-case-bound",
      "output_directory": "evidence/real_case_vertical_slice_v1/outputs/hsp90_b1_rule_to_operator/operator_outputs",
      "output_files": [
        "directional_runs.tsv",
        "results_summary.json",
        "trajectory_time_anatomy.tsv",
        "trajectory_time_bins_50ns.tsv"
      ],
      "output_validation": {
        "observed_counts": {
          "directional_run_rows": 1175,
          "trajectory_time_anatomy_rows": 120,
          "trajectory_time_bin_rows": 840
        },
        "output_hashes": {
          "directional_runs.tsv": "9650bc5beb3ab4dd7163b256e317459e64f524d0803ba8c985ff6bdec6047666",
          "results_summary.json": "f285a33c63a59f1601f0aefa4f98afe62fb247121c575574cf1f42018d93e646",